Seq,Product_ID,List_Price,Description
439,101050501,49.99,Contemporary and Clean Jackets Green Plain
440,103020601,39.99,Relaxed and Casual Shoes Purple Plain
441,103060310,169.99,Relaxed and Casual sweaters Brown Animal print
442,104050310,89.99,Dress to Impress Jackets Brown Animal print
443,104020410,59.99,Dress to Impress Shoes Blue Animal print
444,101020310,29.99,Contemporary and Clean Shoes Brown Animal print
445,201030308,59.99,Contemporary and Clean Shirts Brown Polka Dots
446,110020208,59.99,Runway Inspired Shoes Black Polka Dots
447,104010509,69.99,Dress to Impress Hats Green Floral
448,101050105,79.99,Contemporary and Clean Jackets White Plaid
449,101030302,9.99,Contemporary and Clean Shirts Brown Striped
450,104020102,59.99,Dress to Impress Shoes White Striped
451,203060502,99.99,Relaxed and Casual sweaters Green Striped
452,103020503,39.99,Relaxed and Casual Shoes Green Geometric
453,103030504,79.99,Relaxed and Casual Shirts Green Check
454,103050809,69.99,Relaxed and Casual Jackets Pink Floral
455,103031010,49.99,Relaxed and Casual Shirts Orange Animal print
456,203040108,119.99,Relaxed and Casual Pants White Polka Dots
457,101040309,49.99,Contemporary and Clean Pants Brown Floral
458,101030507,89.99,Contemporary and Clean Shirts Green Houndstooth
459,102030403,39.99,Utility and Basics Shirts Blue Geometric
460,109010403,29.99,Romantic and Bohemian Hats Blue Geometric
461,309020701,49.99,Romantic and Bohemian Shoes Red Plain
462,110050503,159.99,Runway Inspired Jackets Green Geometric
463,109020704,59.99,Romantic and Bohemian Shoes Red Check
464,202010703,29.99,Utility and Basics Hats Red Geometric
465,104060601,159.99,Dress to Impress sweaters Purple Plain
466,102050101,119.99,Utility and Basics Jackets White Plain
467,103040110,149.99,Relaxed and Casual Pants White Animal print
468,302030101,39.99,Utility and Basics Shirts White Plain
469,203030108,79.99,Relaxed and Casual Shirts White Polka Dots
470,104060808,129.99,Dress to Impress sweaters Pink Polka Dots
471,104051009,139.99,Dress to Impress Jackets Orange Floral
472,203040101,69.99,Relaxed and Casual Pants White Plain
473,101030101,69.99,Contemporary and Clean Shirts White Plain
474,210051005,59.99,Runway Inspired Jackets Orange Plaid
475,110010905,59.99,Runway Inspired Hats Yellow Plaid
476,101030410,89.99,Contemporary and Clean Shirts Blue Animal print
477,101020210,29.99,Contemporary and Clean Shoes Black Animal print
478,102030401,69.99,Utility and Basics Shirts Blue Plain
479,103020408,49.99,Relaxed and Casual Shoes Blue Polka Dots
480,204060209,169.99,Dress to Impress sweaters Black Floral
481,204060210,139.99,Dress to Impress sweaters Black Animal print
482,102020407,19.99,Utility and Basics Shoes Blue Houndstooth
483,103020310,39.99,Relaxed and Casual Shoes Brown Animal print
484,102040704,89.99,Utility and Basics Pants Red Check
485,103040604,119.99,Relaxed and Casual Pants Purple Check
486,202030506,69.99,Utility and Basics Shirts Green Paisley
487,102040705,29.99,Utility and Basics Pants Red Plaid
488,104020704,79.99,Dress to Impress Shoes Red Check
489,104040604,119.99,Dress to Impress Pants Purple Check
490,204020507,49.99,Dress to Impress Shoes Green Houndstooth
491,102060606,109.99,Utility and Basics sweaters Purple Paisley
492,101030806,89.99,Contemporary and Clean Shirts Pink Paisley
493,103010603,29.99,Relaxed and Casual Hats Purple Geometric
494,201060604,119.99,Contemporary and Clean sweaters Purple Check
495,101030605,59.99,Contemporary and Clean Shirts Purple Plaid
496,101060505,69.99,Contemporary and Clean sweaters Green Plaid
497,103050505,129.99,Relaxed and Casual Jackets Green Plaid
498,103041007,59.99,Relaxed and Casual Pants Orange Houndstooth
499,102050603,59.99,Utility and Basics Jackets Purple Geometric
500,102030603,9.99,Utility and Basics Shirts Purple Geometric
501,201060203,89.99,Contemporary and Clean sweaters Black Geometric
502,201040105,129.99,Contemporary and Clean Pants White Plaid
503,103050205,39.99,Relaxed and Casual Jackets Black Plaid
504,104060203,59.99,Dress to Impress sweaters Black Geometric
505,103040103,59.99,Relaxed and Casual Pants White Geometric
506,103060105,69.99,Relaxed and Casual sweaters White Plaid
507,202050208,29.99,Utility and Basics Jackets Black Polka Dots
508,102060306,99.99,Utility and Basics sweaters Brown Paisley
509,201020209,29.99,Contemporary and Clean Shoes Black Floral
510,110050104,69.99,Runway Inspired Jackets White Check
511,110020104,79.99,Runway Inspired Shoes White Check
512,204040103,119.99,Dress to Impress Pants White Geometric
513,101030501,99.99,Contemporary and Clean Shirts Green Plain
514,104020201,79.99,Dress to Impress Shoes Black Plain
515,101020510,49.99,Contemporary and Clean Shoes Green Animal print
516,101061005,39.99,Contemporary and Clean sweaters Orange Plaid
517,102040804,49.99,Utility and Basics Pants Pink Check
518,104030704,39.99,Dress to Impress Shirts Red Check
519,110030307,79.99,Runway Inspired Shirts Brown Houndstooth
520,104060408,199.99,Dress to Impress sweaters Blue Polka Dots
521,210010406,69.99,Runway Inspired Hats Blue Paisley
522,110010307,49.99,Runway Inspired Hats Brown Houndstooth
523,110060408,169.99,Runway Inspired sweaters Blue Polka Dots
524,105030609,99.99,Hispter Trend Shirts Purple Floral
525,108030809,89.99,Athletic Shirts Pink Floral
526,207060709,119.99,Party Pieces sweaters Red Floral
527,101020907,19.99,Contemporary and Clean Shoes Yellow Houndstooth
528,101020109,49.99,Contemporary and Clean Shoes White Floral
529,103030909,99.99,Relaxed and Casual Shirts Yellow Floral
530,201040108,109.99,Contemporary and Clean Pants White Polka Dots
531,201040809,89.99,Contemporary and Clean Pants Pink Floral
532,101021009,39.99,Contemporary and Clean Shoes Orange Floral
533,101030109,29.99,Contemporary and Clean Shirts White Floral
534,107010110,9.99,Party Pieces Hats White Animal print
535,101030809,29.99,Contemporary and Clean Shirts Pink Floral
536,102060807,129.99,Utility and Basics sweaters Pink Houndstooth
537,101060609,139.99,Contemporary and Clean sweaters Purple Floral
538,102040801,19.99,Utility and Basics Pants Pink Plain
539,202010710,19.99,Utility and Basics Hats Red Animal print
540,103060808,109.99,Relaxed and Casual sweaters Pink Polka Dots
541,104010801,69.99,Dress to Impress Hats Pink Plain
542,104010808,69.99,Dress to Impress Hats Pink Polka Dots
543,210061005,119.99,Runway Inspired sweaters Orange Plaid
544,110030706,99.99,Runway Inspired Shirts Red Paisley
545,104041007,179.99,Dress to Impress Pants Orange Houndstooth
546,102060201,129.99,Utility and Basics sweaters Black Plain
547,104040306,99.99,Dress to Impress Pants Brown Paisley
548,202040104,29.99,Utility and Basics Pants White Check
549,103040204,119.99,Relaxed and Casual Pants Black Check
550,103030104,49.99,Relaxed and Casual Shirts White Check
551,101010203,29.99,Contemporary and Clean Hats Black Geometric
552,203020102,19.99,Relaxed and Casual Shoes White Striped
553,202030604,29.99,Utility and Basics Shirts Purple Check
554,104010401,59.99,Dress to Impress Hats Blue Plain
555,101020303,29.99,Contemporary and Clean Shoes Brown Geometric
556,104020702,49.99,Dress to Impress Shoes Red Striped
557,101050303,79.99,Contemporary and Clean Jackets Brown Geometric
558,102040504,129.99,Utility and Basics Pants Green Check
559,301060404,139.99,Contemporary and Clean sweaters Blue Check
560,104041006,139.99,Dress to Impress Pants Orange Paisley
561,202040904,49.99,Utility and Basics Pants Yellow Check
562,204060806,169.99,Dress to Impress sweaters Pink Paisley
563,110051006,89.99,Runway Inspired Jackets Orange Paisley
564,104050405,159.99,Dress to Impress Jackets Blue Plaid
565,104030406,69.99,Dress to Impress Shirts Blue Paisley
566,104050506,159.99,Dress to Impress Jackets Green Paisley
567,304010907,39.99,Dress to Impress Hats Yellow Houndstooth
568,103010807,39.99,Relaxed and Casual Hats Pink Houndstooth
569,104020610,79.99,Dress to Impress Shoes Purple Animal print
570,103010607,9.99,Relaxed and Casual Hats Purple Houndstooth
571,102040810,79.99,Utility and Basics Pants Pink Animal print
572,104050807,149.99,Dress to Impress Jackets Pink Houndstooth
573,202030707,49.99,Utility and Basics Shirts Red Houndstooth
574,103030603,59.99,Relaxed and Casual Shirts Purple Geometric
575,301030902,79.99,Contemporary and Clean Shirts Yellow Striped
576,101030804,39.99,Contemporary and Clean Shirts Pink Check
577,101030802,99.99,Contemporary and Clean Shirts Pink Striped
578,103030904,69.99,Relaxed and Casual Shirts Yellow Check
579,103030804,39.99,Relaxed and Casual Shirts Pink Check
580,301060704,139.99,Contemporary and Clean sweaters Red Check
581,104010205,59.99,Dress to Impress Hats Black Plaid
